table_id,row_id,impact,companies_number_,increase,decrease,no_impact,don_t_know
11574,r001,Number of workers employed,"['55,502', '&nbsp;']","['12.3', '&nbsp;']","['6.4', '&nbsp;']","['68.8', '&nbsp;']","['12.4', '&nbsp;']"
11574,r002,Skill level of workers employed,"['55,502', '&nbsp;']","['17.6', '&nbsp;']","['4.7', '&nbsp;']","['65.2', '&nbsp;']","['12.5', '&nbsp;']"
11574,r003,"Scientific, technological, engineering, and mathematical skills of workers","['55,502', '&nbsp;']","['13.5', '&nbsp;']","['3.7', '&nbsp;']","['68.5', '&nbsp;']","['14.2', '&nbsp;']"
11574,r004,Number of production workers,"['55,502', '&nbsp;']","['7.2', '&nbsp;']","['4.8', '&nbsp;']","['73.8', '&nbsp;']","['14.1', '&nbsp;']"
11574,r005,Number of nonproduction workers,"['55,502', '&nbsp;']","['6.4', '&nbsp;']","['4.5', '&nbsp;']","['74.4', '&nbsp;']","['14.6', '&nbsp;']"
11574,r006,Number of supervisory workers,"['55,502', '&nbsp;']","['7.2', '&nbsp;']","['4.4', '&nbsp;']","['74.7', '&nbsp;']","['13.6', '&nbsp;']"
11574,r007,Number of nonsupervisory workers,"['55,502', '&nbsp;']","['7.8', '&nbsp;']","['3.8', '&nbsp;']","['74.1', '&nbsp;']","['14.2', '&nbsp;']"
