table_id,row_id,_b_agency_b_full_path,_b_agency_b_level_1,_b_agency_b_level_2,_b_agency_b_level_3,_b_agency_b_level_4,_b_agency_b_level_5,_b_agency_b_hierarchy_depth,field_2000,field_2001,field_2002,field_2003,field_2004,field_2005,field_2006,field_2007,field_2008,field_2009,field_2010
3965,r001,All agencies,All agencies,,,,,1,37439.7,39778.8,45701.9,52455.8,58716.6,65110.2,68194.3,73169.3,73212.4,77398.2,76626.5
3965,r002,All agencies -> Departments,All agencies,Departments,,,,2,,,,,,,,,,,
3965,r003,All agencies -> Departments -> Department of Agriculture,All agencies,Departments,Department of Agriculture,,,3,135.4,155.3,161.3,170.5,183.4,181.5,183.1,180.8,182.5,191.7,223.2
3965,r004,All agencies -> Departments -> Department of Agriculture -> Agricultural Marketing Service,All agencies,Departments,Department of Agriculture,Agricultural Marketing Service,,4,0.8,0.7,0.8,0.7,1.0,0.2,0.0,0.0,2.5,2.1,2.2
3965,r005,All agencies -> Departments -> Department of Agriculture -> Agricultural Research Service,All agencies,Departments,Department of Agriculture,Agricultural Research Service,,4,79.6,89.5,95.4,95.6,109.8,110.8,113.5,114.2,112.3,114.1,117.8
3965,r006,All agencies -> Departments -> Department of Agriculture -> Animal and Plant Health Inspection Service,All agencies,Departments,Department of Agriculture,Animal and Plant Health Inspection Service,,4,20.6,25.4,23.7,28.0,24.4,24.4,25.5,26.0,28.4,28.9,30.1
3965,r007,All agencies -> Departments -> Department of Agriculture -> Food Safety and Inspection Service,All agencies,Departments,Department of Agriculture,Food Safety and Inspection Service,,4,0.3,0.4,NA,NA,NA,NA,NA,NA,NA,NA,NA
3965,r008,All agencies -> Departments -> Department of Agriculture -> Forest Service,All agencies,Departments,Department of Agriculture,Forest Service,,4,31.2,33.2,35.4,40.9,41.4,46.2,44.1,40.5,39.3,46.6,73.1
3965,r009,"All agencies -> Departments -> Department of Agriculture -> Grain Inspection, Packers, and Stockyards Administration",All agencies,Departments,Department of Agriculture,"Grain Inspection, Packers, and Stockyards Administration",,4,2.9,6.1,6.0,5.3,6.7,0.0,0.0,0.0,0.0,0.0,0.0
3965,r010,All agencies -> Departments -> Department of Commerce,All agencies,Departments,Department of Commerce,,,3,140.7,169.6,156.9,153.8,171.0,143.9,101.5,99.2,80.8,187.8,139.4
3965,r011,All agencies -> Departments -> Department of Commerce -> National Institute of Standards and Technology,All agencies,Departments,Department of Commerce,National Institute of Standards and Technology,,4,95.6,85.2,96.7,95.0,84.5,61.2,30.3,41.2,23.2,21.2,34.1
3965,r012,All agencies -> Departments -> Department of Commerce -> National Oceanic and Atmospheric Administration,All agencies,Departments,Department of Commerce,National Oceanic and Atmospheric Administration,,4,18.7,22.1,22.0,19.8,46.3,63.5,55.1,40.7,38.1,143.7,67.4
3965,r013,All agencies -> Departments -> Department of Commerce -> National Telecommunications and Information Administration,All agencies,Departments,Department of Commerce,National Telecommunications and Information Administration,,4,17.7,46.2,15.5,17.1,17.8,0.0,0.0,0.0,0.0,0.0,0.0
3965,r014,All agencies -> Departments -> Department of Commerce -> U.S. Census Bureau,All agencies,Departments,Department of Commerce,U.S. Census Bureau,,4,8.7,16.1,22.7,21.9,22.4,19.3,16.1,17.3,19.4,22.9,37.8
3965,r015,All agencies -> Departments -> Department of Defense,All agencies,Departments,Department of Defense,,,3,31293.7,33175.8,39147.4,46081.9,52095.0,57456.8,60118.7,65817.3,65252.4,69064.6,66405.6
3965,r016,All agencies -> Departments -> Department of Defense -> Defense agencies and activities,All agencies,Departments,Department of Defense,Defense agencies and activities,,4,5291.5,6871.8,9422.2,10291.3,11189.0,13572.5,12563.0,14037.1,13874.8,14034.0,13820.9
3965,r017,All agencies -> Departments -> Department of Defense -> Department of the Air Force,All agencies,Departments,Department of Defense,Department of the Air Force,,4,13005.5,12361.1,13382.6,16929.6,19108.5,18724.6,20336.8,23723.9,23640.4,26346.2,24843.2
3965,r018,All agencies -> Departments -> Department of Defense -> Department of the Army,All agencies,Departments,Department of Defense,Department of the Army,,4,4352.8,5135.7,5965.1,6492.0,7751.9,8508.1,9865.7,9907.3,10246.7,10241.5,9178.1
3965,r019,All agencies -> Departments -> Department of Defense -> Department of the Navy,All agencies,Departments,Department of Defense,Department of the Navy,,4,8354.0,8576.6,10144.1,12133.4,13747.5,16344.0,17174.3,17967.2,17305.8,18256.7,18366.5
3965,r020,"All agencies -> Departments -> Department of Defense -> Operational Test and Evaluation, Director",All agencies,Departments,Department of Defense,"Operational Test and Evaluation, Director",,4,32.9,205.3,233.5,235.7,298.2,307.5,178.9,181.9,184.7,186.2,196.9
3965,r021,"All agencies -> Departments -> Department of Defense -> Test and Evaluation, Deputy Under Secretary of Defense",All agencies,Departments,Department of Defense,"Test and Evaluation, Deputy Under Secretary of Defense",,4,257.0,25.3,na,na,na,na,na,na,na,na,na
3965,r022,All agencies -> Departments -> Department of Education,All agencies,Departments,Department of Education,,,3,83.8,94.4,102.1,101.2,100.6,102.0,121.4,121.6,124.0,119.7,137.7
3965,r023,All agencies -> Departments -> Department of Energy,All agencies,Departments,Department of Energy,,,3,1962.2,2074.9,1981.7,2151.3,2055.7,2029.7,1841.7,2020.9,2139.1,2701.8,3087.2
3965,r024,All agencies -> Departments -> Department of Energy -> Advanced Research Projects Agency&#8212;Energy,All agencies,Departments,Department of Energy,Advanced Research Projects Agency&#8212;Energy,,4,na,na,na,na,na,na,na,na,0.0,0.0,172.7
3965,r025,All agencies -> Departments -> Department of Energy -> Bonneville Power Administration,All agencies,Departments,Department of Energy,Bonneville Power Administration,,4,NA,NA,8.7,8.7,9.3,2.3,1.0,2.5,2.6,0.7,1.3
3965,r026,All agencies -> Departments -> Department of Energy -> Electricity Delivery and Energy Reliability,All agencies,Departments,Department of Energy,Electricity Delivery and Energy Reliability,,4,na,na,na,na,na,13.9,40.1,35.2,55.4,25.5,39.9
3965,r027,All agencies -> Departments -> Department of Energy -> Energy Efficiency and Renewable Energy,All agencies,Departments,Department of Energy,Energy Efficiency and Renewable Energy,,4,na,NA,446.2,371.8,317.0,285.5,219.3,318.7,300.1,930.3,983.4
3965,r028,All agencies -> Departments -> Department of Energy -> Environmental Management,All agencies,Departments,Department of Energy,Environmental Management,,4,NA,NA,73.5,48.6,30.0,34.8,23.8,16.3,17.1,19.3,59.0
3965,r029,All agencies -> Departments -> Department of Energy -> Fossil Energy,All agencies,Departments,Department of Energy,Fossil Energy,,4,NA,NA,218.3,383.5,294.9,350.4,217.5,201.7,221.0,239.7,266.6
3965,r030,All agencies -> Departments -> Department of Energy -> National Nuclear Security Administration,All agencies,Departments,Department of Energy,National Nuclear Security Administration,,4,NA,NA,1229.8,1317.0,1399.8,1341.4,1338.6,1436.5,1540.1,1486.2,1497.1
3965,r031,All agencies -> Departments -> Department of Energy -> National Nuclear Security Administration -> Defense Programs,All agencies,Departments,Department of Energy,National Nuclear Security Administration,Defense Programs,5,NA,NA,478.7,566.8,621.5,539.4,517.4,627.5,740.3,680.3,537.2
3965,r032,All agencies -> Departments -> Department of Energy -> National Nuclear Security Administration -> Fissile Materials Disposition,All agencies,Departments,Department of Energy,National Nuclear Security Administration,Fissile Materials Disposition,5,NA,NA,27.4,25.1,1.0,0.0,0.0,0.0,NA,NA,NA
3965,r033,All agencies -> Departments -> Department of Energy -> National Nuclear Security Administration -> Naval Nuclear Propulsion Program,All agencies,Departments,Department of Energy,National Nuclear Security Administration,Naval Nuclear Propulsion Program,5,NA,NA,637.0,650.0,708.6,740.5,720.4,730.3,711.8,756.4,914.3
3965,r034,All agencies -> Departments -> Department of Energy -> National Nuclear Security Administration -> Office of Defense Nuclear Nonproliferation,All agencies,Departments,Department of Energy,National Nuclear Security Administration,Office of Defense Nuclear Nonproliferation,5,NA,NA,86.8,75.1,68.7,61.5,100.8,78.8,88.0,49.5,45.6
3965,r035,All agencies -> Departments -> Department of Energy -> Nuclear Energy,All agencies,Departments,Department of Energy,Nuclear Energy,,4,NA,NA,0.0,17.7,4.8,1.3,1.5,9.9,3.0,0.0,67.2
3965,r036,All agencies -> Departments -> Department of Energy -> Office of Intelligence,All agencies,Departments,Department of Energy,Office of Intelligence,,4,NA,NA,5.3,4.0,0.0,NA,NA,NA,NA,NA,NA
3965,r037,All agencies -> Departments -> Department of Energy -> Office of Science,All agencies,Departments,Department of Energy,Office of Science,,4,NA,NA,0.0,0.0,0.0,0.0,0.0,0.0,0.0,0.05,0.0
3965,r038,All agencies -> Departments -> Department of Health and Human Services,All agencies,Departments,Department of Health and Human Services,,,3,512.8,693.3,780.7,111.3,142.0,128.5,86.0,90.8,94.5,94.1,137.0
3965,r039,All agencies -> Departments -> Department of Health and Human Services -> Agency for Healthcare Research and Quality,All agencies,Departments,Department of Health and Human Services,Agency for Healthcare Research and Quality,,4,11.9,21.6,23.9,24.7,24.3,25.5,25.5,25.5,26.7,30.2,63.1
3965,r040,All agencies -> Departments -> Department of Health and Human Services -> Agency for Toxic Substances and Disease Registry,All agencies,Departments,Department of Health and Human Services,Agency for Toxic Substances and Disease Registry,,4,0.0,0.0,0.0,0.0,0.0,0.2,0.0,0.0,0.0,0.0,0.0
3965,r041,All agencies -> Departments -> Department of Health and Human Services -> Centers for Disease Control and Prevention,All agencies,Departments,Department of Health and Human Services,Centers for Disease Control and Prevention,,4,0.0,0.0,0.0,0.0,0.0,0.0,0.0,17.1,27.3,30.9,37.2
3965,r042,All agencies -> Departments -> Department of Health and Human Services -> Health Resources and Services Administration,All agencies,Departments,Department of Health and Human Services,Health Resources and Services Administration,,4,0.0,34.9,36.8,26.7,30.5,35.2,6.2,6.4,40.4,32.9,36.7
3965,r043,All agencies -> Departments -> Department of Health and Human Services -> Office of the Secretary of Health and Human Services,All agencies,Departments,Department of Health and Human Services,Office of the Secretary of Health and Human Services,,4,3.1,2.5,2.5,2.6,0.0,0.0,0.0,0.0,0.0,0.0,0.0
3965,r044,All agencies -> Departments -> Department of Health and Human Services -> Office of the Secretary of Health and Human Services -> Office of Public Health and Science,All agencies,Departments,Department of Health and Human Services,Office of the Secretary of Health and Human Services,Office of Public Health and Science,5,3.1,2.5,2.5,2.6,NA,NA,NA,NA,NA,NA,NA
3965,r045,All agencies -> Departments -> Department of Health and Human Services -> Substance Abuse and Mental Health Services Administration,All agencies,Departments,Department of Health and Human Services,Substance Abuse and Mental Health Services Administration,,4,497.8,634.3,717.6,57.2,87.2,67.6,54.3,41.8,0.0,0.0,NA
3965,r046,All agencies -> Departments -> Department of Homeland Security,All agencies,Departments,Department of Homeland Security,,,3,na,na,na,NA,532.6,765.0,1119.2,321.0,511.8,325.3,352.6
3965,r047,All agencies -> Departments -> Department of Homeland Security -> Science and Technology Directorate,All agencies,Departments,Department of Homeland Security,Science and Technology Directorate,,4,na,na,na,NA,507.7,756.2,1096.0,305.2,498.7,311.9,335.5
3965,r048,All agencies -> Departments -> Department of Homeland Security -> Transportation Security Administration,All agencies,Departments,Department of Homeland Security,Transportation Security Administration,,4,na,na,na,NA,15.0,0.0,9.1,3.8,0.0,0.0,NA
3965,r049,All agencies -> Departments -> Department of Homeland Security -> U.S. Coast Guard,All agencies,Departments,Department of Homeland Security,U.S. Coast Guard,,4,na,na,na,NA,9.9,8.8,14.2,12.1,13.0,13.4,17.1
3965,r050,All agencies -> Departments -> Department of Housing and Urban Development,All agencies,Departments,Department of Housing and Urban Development,,,3,30.1,34.9,29.1,25.1,29.2,27.0,22.0,26.5,19.2,21.5,22.9
3965,r051,All agencies -> Departments -> Department of the Interior,All agencies,Departments,Department of the Interior,,,3,31.4,46.9,75.4,63.3,58.1,58.3,52.0,61.4,70.1,74.8,77.7
3965,r052,All agencies -> Departments -> Department of the Interior -> Bureau of Reclamation,All agencies,Departments,Department of the Interior,Bureau of Reclamation,,4,2.5,2.4,6.8,6.1,7.1,8.3,5.7,5.5,5.8,5.5,2.4
3965,r053,All agencies -> Departments -> Department of the Interior -> National Park Service,All agencies,Departments,Department of the Interior,National Park Service,,4,0.0,2.9,8.6,3.9,2.8,0.4,0.2,0.7,1.9,2.8,1.1
3965,r054,All agencies -> Departments -> Department of the Interior -> U.S. Geological Survey,All agencies,Departments,Department of the Interior,U.S. Geological Survey,,4,29.0,41.5,60.1,53.3,48.2,49.6,46.0,55.2,62.4,66.4,74.2
3965,r055,All agencies -> Departments -> Department of Justice,All agencies,Departments,Department of Justice,,,3,30.9,41.6,50.0,91.6,58.2,69.9,75.0,113.7,35.9,22.5,37.9
3965,r056,All agencies -> Departments -> Department of Justice -> Bureau of Prisons,All agencies,Departments,Department of Justice,Bureau of Prisons,,4,4.3,5.6,5.1,5.0,5.8,8.4,9.4,8.5,7.5,7.7,7.9
3965,r057,All agencies -> Departments -> Department of Justice -> Federal Bureau of Investigation,All agencies,Departments,Department of Justice,Federal Bureau of Investigation,,4,10.0,19.0,33.6,42.8,34.0,33.5,34.3,70.8,26.1,14.5,30.0
3965,r058,All agencies -> Departments -> Department of Justice -> Immigration and Naturalization Service,All agencies,Departments,Department of Justice,Immigration and Naturalization Service,,4,0.6,0.9,0.0,na,na,na,na,na,na,na,na
3965,r059,All agencies -> Departments -> Department of Justice -> Office of Justice Programs,All agencies,Departments,Department of Justice,Office of Justice Programs,,4,16.1,16.0,11.4,43.8,18.5,28.0,31.2,34.4,2.3,0.3,0.0
3965,r060,All agencies -> Departments -> Department of Labor,All agencies,Departments,Department of Labor,,,3,37.5,40.3,120.9,152.8,161.9,128.4,65.1,1.6,1.5,2.2,2.4
3965,r061,All agencies -> Departments -> Department of Labor -> Employment and Training Administration,All agencies,Departments,Department of Labor,Employment and Training Administration,,4,35.9,35.9,119.3,151.0,161.0,127.0,63.5,0.0,0.0,0.0,NA
3965,r062,All agencies -> Departments -> Department of Labor -> Office of the Secretary of Labor,All agencies,Departments,Department of Labor,Office of the Secretary of Labor,,4,1.0,3.8,0.9,1.0,0.1,0.0,0.0,0.0,0.0,0.0,0.0
3965,r063,All agencies -> Departments -> Department of Labor -> Pension Benefit Guaranty Corp.,All agencies,Departments,Department of Labor,Pension Benefit Guaranty Corp.,,4,0.7,0.6,0.7,0.8,0.9,1.3,1.6,1.6,1.5,2.2,2.4
3965,r064,All agencies -> Departments -> Department of Transportation,All agencies,Departments,Department of Transportation,,,3,123.0,228.7,284.6,260.4,269.1,163.8,284.0,201.7,172.0,239.2,262.2
3965,r065,All agencies -> Departments -> Department of Transportation -> Federal Aviation Administration,All agencies,Departments,Department of Transportation,Federal Aviation Administration,,4,54.6,100.8,100.3,109.4,99.5,98.2,123.4,113.7,116.7,134.8,153.8
3965,r066,All agencies -> Departments -> Department of Transportation -> Federal Highway Administration,All agencies,Departments,Department of Transportation,Federal Highway Administration,,4,33.9,82.5,119.8,112.4,121.5,22.2,111.7,56.4,29.9,31.0,41.0
3965,r067,All agencies -> Departments -> Department of Transportation -> Federal Motor Carrier Safety Administration,All agencies,Departments,Department of Transportation,Federal Motor Carrier Safety Administration,,4,1.1,3.4,3.6,0.0,0.0,0.0,0.0,0.0,0.0,0.0,0.3
3965,r068,All agencies -> Departments -> Department of Transportation -> Federal Railroad Administration,All agencies,Departments,Department of Transportation,Federal Railroad Administration,,4,3.1,0.3,3.5,3.4,4.3,5.0,6.4,6.2,0.0,31.5,31.4
3965,r069,All agencies -> Departments -> Department of Transportation -> Federal Transit Administration,All agencies,Departments,Department of Transportation,Federal Transit Administration,,4,8.9,8.0,5.2,7.1,4.6,3.9,13.0,3.2,5.8,6.3,2.6
3965,r070,All agencies -> Departments -> Department of Transportation -> Office of the Secretary of Transportation,All agencies,Departments,Department of Transportation,Office of the Secretary of Transportation,,4,4.0,13.0,18.4,21.0,31.8,21.0,14.8,6.5,13.5,20.5,23.5
3965,r071,All agencies -> Departments -> Department of Transportation -> Pipeline and Hazardous Materials Safety Administration,All agencies,Departments,Department of Transportation,Pipeline and Hazardous Materials Safety Administration,,4,na,na,na,na,7.4,12.1,13.0,14.7,6.1,7.7,7.8
3965,r072,All agencies -> Departments -> Department of Transportation -> Research and Innovative Technology Administration,All agencies,Departments,Department of Transportation,Research and Innovative Technology Administration,,4,na,na,na,na,0.0,1.4,1.7,1.0,0.0,7.5,1.9
3965,r073,All agencies -> Departments -> Department of Transportation -> Research and Special Programs Administration,All agencies,Departments,Department of Transportation,Research and Special Programs Administration,,4,2.3,3.1,6.4,7.1,na,na,na,na,na,na,na
3965,r074,All agencies -> Departments -> Department of Transportation -> Transportation Security Administration,All agencies,Departments,Department of Transportation,Transportation Security Administration,,4,na,na,11.8,na,na,na,na,na,na,na,na
3965,r075,All agencies -> Departments -> Department of Transportation -> U.S. Coast Guard,All agencies,Departments,Department of Transportation,U.S. Coast Guard,,4,15.0,17.7,15.6,na,na,na,na,na,na,na,na
3965,r076,All agencies -> Departments -> Department of the Treasury,All agencies,Departments,Department of the Treasury,,,3,10.3,4.5,12.6,1.3,1.2,3.0,4.4,4.4,1.0,1.6,0.2
3965,r077,All agencies -> Departments -> Department of the Treasury -> Bureau of Engraving and Printing,All agencies,Departments,Department of the Treasury,Bureau of Engraving and Printing,,4,0.2,0.05,1.8,0.6,0.2,0.6,0.7,0.9,0.4,0.8,0.2
3965,r078,All agencies -> Departments -> Department of the Treasury -> Internal Revenue Service,All agencies,Departments,Department of the Treasury,Internal Revenue Service,,4,7.0,0.7,0.0,0.0,0.0,0.0,0.0,0.0,0.0,0.0,0.0
3965,r079,All agencies -> Departments -> Department of the Treasury -> U.S. Customs Service,All agencies,Departments,Department of the Treasury,U.S. Customs Service,,4,1.8,3.0,10.6,na,na,na,na,na,na,na,na
3965,r080,All agencies -> Departments -> Department of the Treasury -> U.S. Mint,All agencies,Departments,Department of the Treasury,U.S. Mint,,4,1.3,0.8,0.3,0.7,1.0,2.4,3.7,3.5,0.6,0.8,0.0
3965,r081,All agencies -> Departments -> Department of Veterans Affairs,All agencies,Departments,Department of Veterans Affairs,,,3,7.0,6.8,14.5,15.8,21.3,19.3,19.7,21.4,23.0,32.7,34.0
3965,r082,All agencies -> Other agencies,All agencies,Other agencies,,,,2,,,,,,,,,,,
3965,r083,All agencies -> Other agencies -> Agency for International Development,All agencies,Other agencies,Agency for International Development,,,3,29.5,27.8,22.2,23.6,23.4,40.8,40.0,0.0,0.0,0.0,0.0
3965,r084,All agencies -> Other agencies -> Environmental Protection Agency,All agencies,Other agencies,Environmental Protection Agency,,,3,91.5,99.8,91.5,105.3,125.1,116.0,116.7,83.8,81.8,84.7,87.5
3965,r085,All agencies -> Other agencies -> Federal Communications Commission,All agencies,Other agencies,Federal Communications Commission,,,3,0.0,0.0,0.0,0.0,4.4,3.7,0.4,2.1,0.0,0.1,0.0
3965,r086,All agencies -> Other agencies -> Library of Congress,All agencies,Other agencies,Library of Congress,,,3,1.9,1.1,1.3,1.2,1.6,7.0,4.0,6.7,0.9,0.3,0.7
3965,r087,All agencies -> Other agencies -> National Aeronautics and Space Administration,All agencies,Other agencies,National Aeronautics and Space Administration,,,3,2917.9,2883.1,2669.7,2945.5,2683.1,3665.7,3939.2,3994.4,4421.8,4233.5,5618.4
3965,r088,All agencies -> Other agencies -> National Science Foundation,All agencies,Other agencies,National Science Foundation,,,3,0.0,0.05,0.0,0.0,0.0,0.0,0.0,0.0,0.0,0.0,0.0
