table_id,row_id,data_source,data_collection_sponsor_agency,data_years,information_used_in_report,respondent,coverage
1641,r001,"Occupational Employment Statistics (OES), https://www.bls.gov/oes/","Department of Labor, Bureau of Labor Statistics",Through 2017,"Worker occupation, salary, industry, employer location (national, state, metropolitan statistical area)",Employing organizations,"All full-time and part-time wage and salary workers in nonfarm industries; does not cover self-employed, owners and partners in unincorporated firms, household workers, or unpaid family workers"
1641,r002,"National Survey of College Graduates (NSCG), https://www.nsf.gov/statistics/srvygrads/","Department of Commerce, Census Bureau; National Center for Science and Engineering Statistics, National Science Foundation",Through 2017,"Employment status, occupation, job characteristics (work activities, technical expertise), salary, detailed educational history, demographic characteristics",Individuals,"Individuals with a bachelor’s degree or higher in any field, including an oversample of individuals with a bachelor's degree or higher in an S&E or S&E-related field or with non-S&E degrees but working in an S&E or S&E-related occupation"
1641,r003,"Survey of Doctorate Recipients (SDR), https://www.nsf.gov/statistics/srvydoctoratework/","National Center for Science and Engineering Statistics, National Science Foundation",Through 2017,"Employment status, occupation, job characteristics (work activities, technical expertise), salary, detailed educational history, demographic characteristics",Individuals,Individuals with U.S.-awarded research doctorates (includes both U.S. and non-U.S. residents) 
1641,r004,"American Community Survey (ACS), https://www.census.gov/programs-surveys/acs/","Department of Commerce, Census Bureau",Through 2017,"Employment status, occupation, educational attainment, demographic characteristics",Households,U.S. population
1641,r005,"Current Population Survey (CPS), https://www.census.gov/cps/, https://www.bls.gov/cps/","Department of Commerce, Census Bureau/Department of Labor, Bureau of Labor Statistics",Through 2017,"Employment status, occupation ",Households,Civilian noninstitutional population ages 16 or over
