table_id,row_id,assessment,1979_n_1_635_,1981_n_1_581_,1985_n_1_986_,1988_n_1_021_,1990_n_2_005_,1992_n_974_,1995_n_2_006_,1997_n_2_000_,1999_n_1_882_,2001_n_1_574_,2004_n_2_025_,2006_n_1_864_,2008_n_2_021_,2010_n_1_434_,2012_n_2_256_,2014_n_2_130_,2016_n_1_390_,2018_n_1_175_
2257,r001,Benefits strongly outweigh harmful results,46,42,44,53,47,42,43,47,47,47,52,48,42,46,50,43,45,45
2257,r002,Benefits slightly outweigh harmful results,24,28,25,23,25,30,29,28,27,25,27,22,26,23,22,26,27,29
2257,r003,Benefits are about equal to harmful results,13,12,4,5,7,6,3,6,5,12,3,17,16,14,13,16,12,10
2257,r004,Harmful results slightly outweigh benefits,7,12,13,8,10,12,10,8,10,7,10,4,7,7,6,7,6,8
2257,r005,Harmful results strongly outweigh benefits,4,6,6,4,3,5,3,4,5,3,3,2,2,2,2,2,2,2
2257,r006,Don't know,6,1,8,7,8,5,13,7,6,6,5,6,7,8,8,6,8,6
