table_id,row_id,_b_agency_or_facility_b_full_path,_b_agency_or_facility_b_level_1,_b_agency_or_facility_b_level_2,_b_agency_or_facility_b_level_3,_b_agency_or_facility_b_level_4,_b_agency_or_facility_b_level_5,_b_agency_or_facility_b_hierarchy_depth,field_reporting_unit,field_responded_to_survey
12498,r001,Department of Agriculture,Department of Agriculture,,,,,1,No,
12498,r002,Department of Agriculture -> Agricultural Research Service,Department of Agriculture,Agricultural Research Service,,,,2,No,
12498,r003,Department of Agriculture -> Agricultural Research Service -> Midwest Area,Department of Agriculture,Agricultural Research Service,Midwest Area,,,3,Yes,Yes
12498,r004,Department of Agriculture -> Agricultural Research Service -> Midwest Area -> Avian Disease and Oncology Laboratory,Department of Agriculture,Agricultural Research Service,Midwest Area,Avian Disease and Oncology Laboratory,,4,No,
12498,r005,Department of Agriculture -> Agricultural Research Service -> Midwest Area -> Biological Control of Insects Research Laboratory,Department of Agriculture,Agricultural Research Service,Midwest Area,Biological Control of Insects Research Laboratory,,4,No,
12498,r006,Department of Agriculture -> Agricultural Research Service -> Midwest Area -> Cereal Crops Research Unit,Department of Agriculture,Agricultural Research Service,Midwest Area,Cereal Crops Research Unit,,4,No,
12498,r007,Department of Agriculture -> Agricultural Research Service -> Midwest Area -> Cereal Disease Laboratory,Department of Agriculture,Agricultural Research Service,Midwest Area,Cereal Disease Laboratory,,4,No,
12498,r008,Department of Agriculture -> Agricultural Research Service -> Midwest Area -> Corn Insects and Crop Genetics Research,Department of Agriculture,Agricultural Research Service,Midwest Area,Corn Insects and Crop Genetics Research,,4,No,
12498,r009,Department of Agriculture -> Agricultural Research Service -> Midwest Area -> Crop Production and Pest Control Research,Department of Agriculture,Agricultural Research Service,Midwest Area,Crop Production and Pest Control Research,,4,No,
12498,r010,Department of Agriculture -> Agricultural Research Service -> Midwest Area -> Cropping Systems and Water Quality Research Unit,Department of Agriculture,Agricultural Research Service,Midwest Area,Cropping Systems and Water Quality Research Unit,,4,No,
12498,r011,Department of Agriculture -> Agricultural Research Service -> Midwest Area -> Dairy Forage Research Center,Department of Agriculture,Agricultural Research Service,Midwest Area,Dairy Forage Research Center,,4,No,
12498,r012,Department of Agriculture -> Agricultural Research Service -> Midwest Area -> Food Animal Environmental System Research,Department of Agriculture,Agricultural Research Service,Midwest Area,Food Animal Environmental System Research,,4,No,
12498,r013,Department of Agriculture -> Agricultural Research Service -> Midwest Area -> Global Change and Photosynthesis Research,Department of Agriculture,Agricultural Research Service,Midwest Area,Global Change and Photosynthesis Research,,4,No,
12498,r014,Department of Agriculture -> Agricultural Research Service -> Midwest Area -> Livestock Behavior Research,Department of Agriculture,Agricultural Research Service,Midwest Area,Livestock Behavior Research,,4,No,
12498,r015,Department of Agriculture -> Agricultural Research Service -> Midwest Area -> National Animal Disease Center,Department of Agriculture,Agricultural Research Service,Midwest Area,National Animal Disease Center,,4,No,
12498,r016,Department of Agriculture -> Agricultural Research Service -> Midwest Area -> National Center for Agricultural Utilization Research,Department of Agriculture,Agricultural Research Service,Midwest Area,National Center for Agricultural Utilization Research,,4,No,
12498,r017,Department of Agriculture -> Agricultural Research Service -> Midwest Area -> National Laboratory for Agriculture and the Environment,Department of Agriculture,Agricultural Research Service,Midwest Area,National Laboratory for Agriculture and the Environment,,4,No,
12498,r018,Department of Agriculture -> Agricultural Research Service -> Midwest Area -> National Soil Erosion Research,Department of Agriculture,Agricultural Research Service,Midwest Area,National Soil Erosion Research,,4,No,
12498,r019,Department of Agriculture -> Agricultural Research Service -> Midwest Area -> National Soybean Research Center,Department of Agriculture,Agricultural Research Service,Midwest Area,National Soybean Research Center,,4,No,
12498,r020,Department of Agriculture -> Agricultural Research Service -> Midwest Area -> North Central Soil Conservation Research Laboratory,Department of Agriculture,Agricultural Research Service,Midwest Area,North Central Soil Conservation Research Laboratory,,4,No,
12498,r021,Department of Agriculture -> Agricultural Research Service -> Midwest Area -> Plant Genetics Research,Department of Agriculture,Agricultural Research Service,Midwest Area,Plant Genetics Research,,4,No,
12498,r022,Department of Agriculture -> Agricultural Research Service -> Midwest Area -> Plant Introduction Research,Department of Agriculture,Agricultural Research Service,Midwest Area,Plant Introduction Research,,4,No,
12498,r023,Department of Agriculture -> Agricultural Research Service -> Midwest Area -> Plant Science Research Unit,Department of Agriculture,Agricultural Research Service,Midwest Area,Plant Science Research Unit,,4,No,
12498,r024,Department of Agriculture -> Agricultural Research Service -> Midwest Area -> Seacrest Arboretum,Department of Agriculture,Agricultural Research Service,Midwest Area,Seacrest Arboretum,,4,No,
12498,r025,Department of Agriculture -> Agricultural Research Service -> Midwest Area -> Soil and Water Management Research,Department of Agriculture,Agricultural Research Service,Midwest Area,Soil and Water Management Research,,4,No,
12498,r026,Department of Agriculture -> Agricultural Research Service -> Midwest Area -> Sugarbeet and Bean Research,Department of Agriculture,Agricultural Research Service,Midwest Area,Sugarbeet and Bean Research,,4,No,
12498,r027,Department of Agriculture -> Agricultural Research Service -> Midwest Area -> Vegetable Crops Research Unit,Department of Agriculture,Agricultural Research Service,Midwest Area,Vegetable Crops Research Unit,,4,No,
12498,r028,Department of Agriculture -> Agricultural Research Service -> Northeast Area,Department of Agriculture,Agricultural Research Service,Northeast Area,,,3,Yes,Yes
12498,r029,Department of Agriculture -> Agricultural Research Service -> Northeast Area -> Beltsville Agricultural Research Center,Department of Agriculture,Agricultural Research Service,Northeast Area,Beltsville Agricultural Research Center,,4,No,
12498,r030,Department of Agriculture -> Agricultural Research Service -> Northeast Area -> Beltsville Human Nutrition Research Center,Department of Agriculture,Agricultural Research Service,Northeast Area,Beltsville Human Nutrition Research Center,,4,No,
12498,r031,Department of Agriculture -> Agricultural Research Service -> Northeast Area -> Beneficial Insects Introduction Research Unit,Department of Agriculture,Agricultural Research Service,Northeast Area,Beneficial Insects Introduction Research Unit,,4,No,
12498,r032,Department of Agriculture -> Agricultural Research Service -> Northeast Area -> Cool and Cold Water Aquaculture Research,Department of Agriculture,Agricultural Research Service,Northeast Area,Cool and Cold Water Aquaculture Research,,4,No,
12498,r033,Department of Agriculture -> Agricultural Research Service -> Northeast Area -> Eastern Regional Research Center,Department of Agriculture,Agricultural Research Service,Northeast Area,Eastern Regional Research Center,,4,No,
12498,r034,Department of Agriculture -> Agricultural Research Service -> Northeast Area -> Food Systems Research Unit,Department of Agriculture,Agricultural Research Service,Northeast Area,Food Systems Research Unit,,4,No,
12498,r035,Department of Agriculture -> Agricultural Research Service -> Northeast Area -> George Washington Carver Center,Department of Agriculture,Agricultural Research Service,Northeast Area,George Washington Carver Center,,4,No,
12498,r036,Department of Agriculture -> Agricultural Research Service -> Northeast Area -> Grape Genetics Research Unit,Department of Agriculture,Agricultural Research Service,Northeast Area,Grape Genetics Research Unit,,4,No,
12498,r037,"Department of Agriculture -> Agricultural Research Service -> Northeast Area -> Innovative Fruit Production, Improvement, and Protection",Department of Agriculture,Agricultural Research Service,Northeast Area,"Innovative Fruit Production, Improvement, and Protection",,4,No,
12498,r038,Department of Agriculture -> Agricultural Research Service -> Northeast Area -> Jamie L. Whitten Building,Department of Agriculture,Agricultural Research Service,Northeast Area,Jamie L. Whitten Building,,4,No,
12498,r039,Department of Agriculture -> Agricultural Research Service -> Northeast Area -> Jean Mayer Human Nutrition Research Center on Aging,Department of Agriculture,Agricultural Research Service,Northeast Area,Jean Mayer Human Nutrition Research Center on Aging,,4,No,
12498,r040,Department of Agriculture -> Agricultural Research Service -> Northeast Area -> National Arboretum,Department of Agriculture,Agricultural Research Service,Northeast Area,National Arboretum,,4,No,
12498,r041,Department of Agriculture -> Agricultural Research Service -> Northeast Area -> National Cold Water Marine Aquaculture Center,Department of Agriculture,Agricultural Research Service,Northeast Area,National Cold Water Marine Aquaculture Center,,4,No,
12498,r042,"Department of Agriculture -> Agricultural Research Service -> Northeast Area -> New England Plant, Soil, and Water Research Laboratory",Department of Agriculture,Agricultural Research Service,Northeast Area,"New England Plant, Soil, and Water Research Laboratory",,4,No,
12498,r043,Department of Agriculture -> Agricultural Research Service -> Northeast Area -> Northeast Area Headquarters,Department of Agriculture,Agricultural Research Service,Northeast Area,Northeast Area Headquarters,,4,No,
12498,r044,Department of Agriculture -> Agricultural Research Service -> Northeast Area -> Pasture System and Watershed Management Research,Department of Agriculture,Agricultural Research Service,Northeast Area,Pasture System and Watershed Management Research,,4,No,
12498,r045,Department of Agriculture -> Agricultural Research Service -> Northeast Area -> Plum Island Animal Disease Center,Department of Agriculture,Agricultural Research Service,Northeast Area,Plum Island Animal Disease Center,,4,No,
12498,r046,Department of Agriculture -> Agricultural Research Service -> Northeast Area -> Residue Chemistry and Predictive Microbiology Research,Department of Agriculture,Agricultural Research Service,Northeast Area,Residue Chemistry and Predictive Microbiology Research,,4,No,
12498,r047,Department of Agriculture -> Agricultural Research Service -> Northeast Area -> Robert W. Holley Center for Agriculture and Health,Department of Agriculture,Agricultural Research Service,Northeast Area,Robert W. Holley Center for Agriculture and Health,,4,No,
12498,r048,Department of Agriculture -> Agricultural Research Service -> Northeast Area -> Sustainable Biofuels and Co-products Research,Department of Agriculture,Agricultural Research Service,Northeast Area,Sustainable Biofuels and Co-products Research,,4,No,
12498,r049,Department of Agriculture -> Agricultural Research Service -> Northeast Area -> The Foreign Disease-Weed Science Research,Department of Agriculture,Agricultural Research Service,Northeast Area,The Foreign Disease-Weed Science Research,,4,No,
12498,r050,Department of Agriculture -> Agricultural Research Service -> Pacific West Area,Department of Agriculture,Agricultural Research Service,Pacific West Area,,,3,Yes,Yes
12498,r051,Department of Agriculture -> Agricultural Research Service -> Pacific West Area -> Aberdeen Research and Extension Center,Department of Agriculture,Agricultural Research Service,Pacific West Area,Aberdeen Research and Extension Center,,4,No,
12498,r052,Department of Agriculture -> Agricultural Research Service -> Pacific West Area -> Animal Disease Research Unit,Department of Agriculture,Agricultural Research Service,Pacific West Area,Animal Disease Research Unit,,4,No,
12498,r053,Department of Agriculture -> Agricultural Research Service -> Pacific West Area -> Arid Land Agricultural Research Center,Department of Agriculture,Agricultural Research Service,Pacific West Area,Arid Land Agricultural Research Center,,4,No,
12498,r054,Department of Agriculture -> Agricultural Research Service -> Pacific West Area -> Carl Hayden Bee Research Center,Department of Agriculture,Agricultural Research Service,Pacific West Area,Carl Hayden Bee Research Center,,4,No,
12498,r055,Department of Agriculture -> Agricultural Research Service -> Pacific West Area -> Columbia Plateau Conservation Research Center,Department of Agriculture,Agricultural Research Service,Pacific West Area,Columbia Plateau Conservation Research Center,,4,No,
12498,r056,Department of Agriculture -> Agricultural Research Service -> Pacific West Area -> Crop Improvement and Protection Research Unit,Department of Agriculture,Agricultural Research Service,Pacific West Area,Crop Improvement and Protection Research Unit,,4,No,
12498,r057,Department of Agriculture -> Agricultural Research Service -> Pacific West Area -> Crops Pathology and Genetics Research Unit,Department of Agriculture,Agricultural Research Service,Pacific West Area,Crops Pathology and Genetics Research Unit,,4,No,
12498,r058,Department of Agriculture -> Agricultural Research Service -> Pacific West Area -> Daniel K. Inouye Pacific Basin Agricultural Research Center,Department of Agriculture,Agricultural Research Service,Pacific West Area,Daniel K. Inouye Pacific Basin Agricultural Research Center,,4,No,
12498,r059,Department of Agriculture -> Agricultural Research Service -> Pacific West Area -> Forage and Range Research Unit,Department of Agriculture,Agricultural Research Service,Pacific West Area,Forage and Range Research Unit,,4,No,
12498,r060,Department of Agriculture -> Agricultural Research Service -> Pacific West Area -> Grain Legume Genetics Physiology Research Unit,Department of Agriculture,Agricultural Research Service,Pacific West Area,Grain Legume Genetics Physiology Research Unit,,4,No,
12498,r061,Department of Agriculture -> Agricultural Research Service -> Pacific West Area -> Great Basin Rangelands Research Unit,Department of Agriculture,Agricultural Research Service,Pacific West Area,Great Basin Rangelands Research Unit,,4,No,
12498,r062,Department of Agriculture -> Agricultural Research Service -> Pacific West Area -> Horticultural Crops Disease and Pest Management Research Unit,Department of Agriculture,Agricultural Research Service,Pacific West Area,Horticultural Crops Disease and Pest Management Research Unit,,4,No,
12498,r063,Department of Agriculture -> Agricultural Research Service -> Pacific West Area -> National Clonal Germplasm Repository,Department of Agriculture,Agricultural Research Service,Pacific West Area,National Clonal Germplasm Repository,,4,No,
12498,r064,Department of Agriculture -> Agricultural Research Service -> Pacific West Area -> National Clonal Germplasm Repository - Tree Fruit and Nut Crops and Grapes,Department of Agriculture,Agricultural Research Service,Pacific West Area,National Clonal Germplasm Repository - Tree Fruit and Nut Crops and Grapes,,4,No,
12498,r065,Department of Agriculture -> Agricultural Research Service -> Pacific West Area -> National Clonal Germplasm Repository for Citrus,Department of Agriculture,Agricultural Research Service,Pacific West Area,National Clonal Germplasm Repository for Citrus,,4,No,
12498,r066,Department of Agriculture -> Agricultural Research Service -> Pacific West Area -> National Forage Seed Production Research Center,Department of Agriculture,Agricultural Research Service,Pacific West Area,National Forage Seed Production Research Center,,4,No,
12498,r067,Department of Agriculture -> Agricultural Research Service -> Pacific West Area -> Northwest Irrigation and Soils Research Unit,Department of Agriculture,Agricultural Research Service,Pacific West Area,Northwest Irrigation and Soils Research Unit,,4,No,
12498,r068,Department of Agriculture -> Agricultural Research Service -> Pacific West Area -> Northwest Sustainable Agroecosystems Research Unit,Department of Agriculture,Agricultural Research Service,Pacific West Area,Northwest Sustainable Agroecosystems Research Unit,,4,No,
12498,r069,Department of Agriculture -> Agricultural Research Service -> Pacific West Area -> Northwest Watershed Research Center,Department of Agriculture,Agricultural Research Service,Pacific West Area,Northwest Watershed Research Center,,4,No,
12498,r070,Department of Agriculture -> Agricultural Research Service -> Pacific West Area -> Physiology and Pathology of Tree Fruits Research Unit,Department of Agriculture,Agricultural Research Service,Pacific West Area,Physiology and Pathology of Tree Fruits Research Unit,,4,No,
12498,r071,Department of Agriculture -> Agricultural Research Service -> Pacific West Area -> Plant Germplasm Introduction and Testing Research Unit,Department of Agriculture,Agricultural Research Service,Pacific West Area,Plant Germplasm Introduction and Testing Research Unit,,4,No,
12498,r072,Department of Agriculture -> Agricultural Research Service -> Pacific West Area -> Poisonous Plant Research Unit,Department of Agriculture,Agricultural Research Service,Pacific West Area,Poisonous Plant Research Unit,,4,No,
12498,r073,"Department of Agriculture -> Agricultural Research Service -> Pacific West Area -> Pollinating Insect-Biology, Management, and Systematics Research Unit",Department of Agriculture,Agricultural Research Service,Pacific West Area,"Pollinating Insect-Biology, Management, and Systematics Research Unit",,4,No,
12498,r074,Department of Agriculture -> Agricultural Research Service -> Pacific West Area -> Range and Meadow Forage Management Research Unit,Department of Agriculture,Agricultural Research Service,Pacific West Area,Range and Meadow Forage Management Research Unit,,4,No,
12498,r075,Department of Agriculture -> Agricultural Research Service -> Pacific West Area -> Salinity Laboratory,Department of Agriculture,Agricultural Research Service,Pacific West Area,Salinity Laboratory,,4,No,
12498,r076,Department of Agriculture -> Agricultural Research Service -> Pacific West Area -> San Joaquin Valley Agricultural Sciences Center,Department of Agriculture,Agricultural Research Service,Pacific West Area,San Joaquin Valley Agricultural Sciences Center,,4,No,
12498,r077,Department of Agriculture -> Agricultural Research Service -> Pacific West Area -> Sheep Experiment Station,Department of Agriculture,Agricultural Research Service,Pacific West Area,Sheep Experiment Station,,4,No,
12498,r078,Department of Agriculture -> Agricultural Research Service -> Pacific West Area -> Southwest Watershed Research Center,Department of Agriculture,Agricultural Research Service,Pacific West Area,Southwest Watershed Research Center,,4,No,
12498,r079,Department of Agriculture -> Agricultural Research Service -> Pacific West Area -> Temperate Tree Fruit and Vegetable Research Unit,Department of Agriculture,Agricultural Research Service,Pacific West Area,Temperate Tree Fruit and Vegetable Research Unit,,4,No,
12498,r080,Department of Agriculture -> Agricultural Research Service -> Pacific West Area -> Western Human Nutrition Research Center,Department of Agriculture,Agricultural Research Service,Pacific West Area,Western Human Nutrition Research Center,,4,No,
12498,r081,Department of Agriculture -> Agricultural Research Service -> Pacific West Area -> Western Regional Research Center,Department of Agriculture,Agricultural Research Service,Pacific West Area,Western Regional Research Center,,4,No,
12498,r082,"Department of Agriculture -> Agricultural Research Service -> Pacific West Area -> Wheat Health, Genetics, and Quality Research Unit",Department of Agriculture,Agricultural Research Service,Pacific West Area,"Wheat Health, Genetics, and Quality Research Unit",,4,No,
12498,r083,Department of Agriculture -> Agricultural Research Service -> Plains Area,Department of Agriculture,Agricultural Research Service,Plains Area,,,3,Yes,Yes
12498,r084,Department of Agriculture -> Agricultural Research Service -> Plains Area -> Agroecosystem Management Research Unit,Department of Agriculture,Agricultural Research Service,Plains Area,Agroecosystem Management Research Unit,,4,No,
12498,r085,Department of Agriculture -> Agricultural Research Service -> Plains Area -> Center For Agriculture Resources Research,Department of Agriculture,Agricultural Research Service,Plains Area,Center For Agriculture Resources Research,,4,No,
12498,r086,Department of Agriculture -> Agricultural Research Service -> Plains Area -> Center for Grain and Animal Health Research,Department of Agriculture,Agricultural Research Service,Plains Area,Center for Grain and Animal Health Research,,4,No,
12498,r087,Department of Agriculture -> Agricultural Research Service -> Plains Area -> Central Great Plains Resources Management Research Unit,Department of Agriculture,Agricultural Research Service,Plains Area,Central Great Plains Resources Management Research Unit,,4,No,
12498,r088,Department of Agriculture -> Agricultural Research Service -> Plains Area -> Children's Nutrition Research Center,Department of Agriculture,Agricultural Research Service,Plains Area,Children's Nutrition Research Center,,4,No,
12498,r089,Department of Agriculture -> Agricultural Research Service -> Plains Area -> Conservation and Production Research Laboratory,Department of Agriculture,Agricultural Research Service,Plains Area,Conservation and Production Research Laboratory,,4,No,
12498,r090,Department of Agriculture -> Agricultural Research Service -> Plains Area -> Cropping Systems Research Laboratory,Department of Agriculture,Agricultural Research Service,Plains Area,Cropping Systems Research Laboratory,,4,No,
12498,r091,Department of Agriculture -> Agricultural Research Service -> Plains Area -> Edward T. Schafer Agricultural Research Center,Department of Agriculture,Agricultural Research Service,Plains Area,Edward T. Schafer Agricultural Research Center,,4,No,
12498,r092,Department of Agriculture -> Agricultural Research Service -> Plains Area -> Fort Keough,Department of Agriculture,Agricultural Research Service,Plains Area,Fort Keough,,4,No,
12498,r093,Department of Agriculture -> Agricultural Research Service -> Plains Area -> Grand Forks Human Nutrition Research Center,Department of Agriculture,Agricultural Research Service,Plains Area,Grand Forks Human Nutrition Research Center,,4,No,
12498,r094,Department of Agriculture -> Agricultural Research Service -> Plains Area -> Grassland Soil and Water Research Laboratory,Department of Agriculture,Agricultural Research Service,Plains Area,Grassland Soil and Water Research Laboratory,,4,No,
12498,r095,Department of Agriculture -> Agricultural Research Service -> Plains Area -> Grazinglands Research Laboratory,Department of Agriculture,Agricultural Research Service,Plains Area,Grazinglands Research Laboratory,,4,No,
12498,r096,Department of Agriculture -> Agricultural Research Service -> Plains Area -> Knipling-Bushland Livestock Insects Research Laboratory,Department of Agriculture,Agricultural Research Service,Plains Area,Knipling-Bushland Livestock Insects Research Laboratory,,4,No,
12498,r097,Department of Agriculture -> Agricultural Research Service -> Plains Area -> North Central Agricultural Research Laboratory,Department of Agriculture,Agricultural Research Service,Plains Area,North Central Agricultural Research Laboratory,,4,No,
12498,r098,Department of Agriculture -> Agricultural Research Service -> Plains Area -> Northern Great Plains Research Laboratory,Department of Agriculture,Agricultural Research Service,Plains Area,Northern Great Plains Research Laboratory,,4,No,
12498,r099,Department of Agriculture -> Agricultural Research Service -> Plains Area -> Northern Plains Agricultural Research Laboratory,Department of Agriculture,Agricultural Research Service,Plains Area,Northern Plains Agricultural Research Laboratory,,4,No,
12498,r100,Department of Agriculture -> Agricultural Research Service -> Plains Area -> Oklahoma Agricultural Experiment Station,Department of Agriculture,Agricultural Research Service,Plains Area,Oklahoma Agricultural Experiment Station,,4,No,
12498,r101,Department of Agriculture -> Agricultural Research Service -> Plains Area -> Range Management Research Unit,Department of Agriculture,Agricultural Research Service,Plains Area,Range Management Research Unit,,4,No,
12498,r102,Department of Agriculture -> Agricultural Research Service -> Plains Area -> Reproduction Research,Department of Agriculture,Agricultural Research Service,Plains Area,Reproduction Research,,4,No,
12498,r103,Department of Agriculture -> Agricultural Research Service -> Plains Area -> Roman L. Hruska  Meat Animal Research Center,Department of Agriculture,Agricultural Research Service,Plains Area,Roman L. Hruska  Meat Animal Research Center,,4,No,
12498,r104,Department of Agriculture -> Agricultural Research Service -> Plains Area -> Southern Plains Agricultural Research Center,Department of Agriculture,Agricultural Research Service,Plains Area,Southern Plains Agricultural Research Center,,4,No,
