table_id,row_id,_b_agency_or_facility_b_full_path,_b_agency_or_facility_b_level_1,_b_agency_or_facility_b_level_2,_b_agency_or_facility_b_level_3,_b_agency_or_facility_b_level_4,_b_agency_or_facility_b_level_5,_b_agency_or_facility_b_hierarchy_depth,field_reporting_unit,field_responded_to_survey
12498,r105,Department of Agriculture -> Agricultural Research Service -> Plains Area -> Southern Plains Range Research Station,Department of Agriculture,Agricultural Research Service,Plains Area,Southern Plains Range Research Station,,4,No,
12498,r106,Department of Agriculture -> Agricultural Research Service -> Plains Area -> Southwestern Cotton Ginning Research Laboratory,Department of Agriculture,Agricultural Research Service,Plains Area,Southwestern Cotton Ginning Research Laboratory,,4,No,
12498,r107,"Department of Agriculture -> Agricultural Research Service -> Plains Area -> Wheat, Sorghum, and Forage Research Unit",Department of Agriculture,Agricultural Research Service,Plains Area,"Wheat, Sorghum, and Forage Research Unit",,4,No,
12498,r108,Department of Agriculture -> Agricultural Research Service -> Southeast Area,Department of Agriculture,Agricultural Research Service,Southeast Area,,,3,Yes,Yes
12498,r109,Department of Agriculture -> Agricultural Research Service -> Southeast Area -> Aquatic Animal Health Research Unit,Department of Agriculture,Agricultural Research Service,Southeast Area,Aquatic Animal Health Research Unit,,4,No,
12498,r110,Department of Agriculture -> Agricultural Research Service -> Southeast Area -> Arkansas Children's Nutrition Center,Department of Agriculture,Agricultural Research Service,Southeast Area,Arkansas Children's Nutrition Center,,4,No,
12498,r111,"Department of Agriculture -> Agricultural Research Service -> Southeast Area -> Center for Medical, Agricultural, and Veterinary Entomology",Department of Agriculture,Agricultural Research Service,Southeast Area,"Center for Medical, Agricultural, and Veterinary Entomology",,4,No,
12498,r112,"Department of Agriculture -> Agricultural Research Service -> Southeast Area -> Coastal Plain Soil, Water, and Plant Conservation Research",Department of Agriculture,Agricultural Research Service,Southeast Area,"Coastal Plain Soil, Water, and Plant Conservation Research",,4,No,
12498,r113,Department of Agriculture -> Agricultural Research Service -> Southeast Area -> Coastal Research and Education Center,Department of Agriculture,Agricultural Research Service,Southeast Area,Coastal Research and Education Center,,4,No,
12498,r114,Department of Agriculture -> Agricultural Research Service -> Southeast Area -> Dale Bumpers National Rice Research Center,Department of Agriculture,Agricultural Research Service,Southeast Area,Dale Bumpers National Rice Research Center,,4,No,
12498,r115,Department of Agriculture -> Agricultural Research Service -> Southeast Area -> Dale Bumpers Small Farms Research Center,Department of Agriculture,Agricultural Research Service,Southeast Area,Dale Bumpers Small Farms Research Center,,4,No,
12498,r116,Department of Agriculture -> Agricultural Research Service -> Southeast Area -> Delta Water Management Research Unit,Department of Agriculture,Agricultural Research Service,Southeast Area,Delta Water Management Research Unit,,4,No,
12498,r117,"Department of Agriculture -> Agricultural Research Service -> Southeast Area -> Food Science, Market Quality, and Handling Research Unit",Department of Agriculture,Agricultural Research Service,Southeast Area,"Food Science, Market Quality, and Handling Research Unit",,4,No,
12498,r118,Department of Agriculture -> Agricultural Research Service -> Southeast Area -> Genetics and Sustainable Agriculture Research Unit,Department of Agriculture,Agricultural Research Service,Southeast Area,Genetics and Sustainable Agriculture Research Unit,,4,No,
12498,r119,Department of Agriculture -> Agricultural Research Service -> Southeast Area -> Harry K. Dupree Stuttgart National Aquaculture Research Center,Department of Agriculture,Agricultural Research Service,Southeast Area,Harry K. Dupree Stuttgart National Aquaculture Research Center,,4,No,
12498,r120,"Department of Agriculture -> Agricultural Research Service -> Southeast Area -> Honey Bee Breeding, Genetics, and Physiology Research Unit",Department of Agriculture,Agricultural Research Service,Southeast Area,"Honey Bee Breeding, Genetics, and Physiology Research Unit",,4,No,
12498,r121,Department of Agriculture -> Agricultural Research Service -> Southeast Area -> Horticultural Research Laboratory,Department of Agriculture,Agricultural Research Service,Southeast Area,Horticultural Research Laboratory,,4,No,
12498,r122,Department of Agriculture -> Agricultural Research Service -> Southeast Area -> Invasive Plant Research Laboratory,Department of Agriculture,Agricultural Research Service,Southeast Area,Invasive Plant Research Laboratory,,4,No,
12498,r123,Department of Agriculture -> Agricultural Research Service -> Southeast Area -> National Peanut Research Laboratory,Department of Agriculture,Agricultural Research Service,Southeast Area,National Peanut Research Laboratory,,4,No,
12498,r124,Department of Agriculture -> Agricultural Research Service -> Southeast Area -> National Poultry Research Center,Department of Agriculture,Agricultural Research Service,Southeast Area,National Poultry Research Center,,4,No,
12498,r125,Department of Agriculture -> Agricultural Research Service -> Southeast Area -> National Sedimentation Laboratory,Department of Agriculture,Agricultural Research Service,Southeast Area,National Sedimentation Laboratory,,4,No,
12498,r126,Department of Agriculture -> Agricultural Research Service -> Southeast Area -> Plant Genetic Resources Conservation Unit,Department of Agriculture,Agricultural Research Service,Southeast Area,Plant Genetic Resources Conservation Unit,,4,No,
12498,r127,Department of Agriculture -> Agricultural Research Service -> Southeast Area -> Plant Science Research Unit,Department of Agriculture,Agricultural Research Service,Southeast Area,Plant Science Research Unit,,4,No,
12498,r128,Department of Agriculture -> Agricultural Research Service -> Southeast Area -> Pollinator Health in Southern Crop Ecosystems Research Unit,Department of Agriculture,Agricultural Research Service,Southeast Area,Pollinator Health in Southern Crop Ecosystems Research Unit,,4,No,
12498,r129,Department of Agriculture -> Agricultural Research Service -> Southeast Area -> Poultry Production and Product Safety Research Unit,Department of Agriculture,Agricultural Research Service,Southeast Area,Poultry Production and Product Safety Research Unit,,4,No,
12498,r130,Department of Agriculture -> Agricultural Research Service -> Southeast Area -> Poultry Research Unit,Department of Agriculture,Agricultural Research Service,Southeast Area,Poultry Research Unit,,4,No,
12498,r131,Department of Agriculture -> Agricultural Research Service -> Southeast Area -> Soil Dynamics Research Unit,Department of Agriculture,Agricultural Research Service,Southeast Area,Soil Dynamics Research Unit,,4,No,
12498,r132,Department of Agriculture -> Agricultural Research Service -> Southeast Area -> Southeast Area Headquarters,Department of Agriculture,Agricultural Research Service,Southeast Area,Southeast Area Headquarters,,4,No,
12498,r133,Department of Agriculture -> Agricultural Research Service -> Southeast Area -> Southeast Regional Biomass Research Center,Department of Agriculture,Agricultural Research Service,Southeast Area,Southeast Regional Biomass Research Center,,4,No,
12498,r134,Department of Agriculture -> Agricultural Research Service -> Southeast Area -> Southeastern Fruit and Tree Nut Research Laboratory,Department of Agriculture,Agricultural Research Service,Southeast Area,Southeastern Fruit and Tree Nut Research Laboratory,,4,No,
12498,r135,Department of Agriculture -> Agricultural Research Service -> Southeast Area -> Southern Regional Research Center,Department of Agriculture,Agricultural Research Service,Southeast Area,Southern Regional Research Center,,4,No,
12498,r136,Department of Agriculture -> Agricultural Research Service -> Southeast Area -> Soybean and Nitrogen Fixation Research,Department of Agriculture,Agricultural Research Service,Southeast Area,Soybean and Nitrogen Fixation Research,,4,No,
12498,r137,Department of Agriculture -> Agricultural Research Service -> Southeast Area -> Subtropical Horticulture Research Station,Department of Agriculture,Agricultural Research Service,Southeast Area,Subtropical Horticulture Research Station,,4,No,
12498,r138,Department of Agriculture -> Agricultural Research Service -> Southeast Area -> Sugarcane Field Station,Department of Agriculture,Agricultural Research Service,Southeast Area,Sugarcane Field Station,,4,No,
12498,r139,Department of Agriculture -> Agricultural Research Service -> Southeast Area -> Sugarcane Research Unit,Department of Agriculture,Agricultural Research Service,Southeast Area,Sugarcane Research Unit,,4,No,
12498,r140,Department of Agriculture -> Agricultural Research Service -> Southeast Area -> Thad Cochran Research Center,Department of Agriculture,Agricultural Research Service,Southeast Area,Thad Cochran Research Center,,4,No,
12498,r141,Department of Agriculture -> Agricultural Research Service -> Southeast Area -> Tropical Agriculture Research Station,Department of Agriculture,Agricultural Research Service,Southeast Area,Tropical Agriculture Research Station,,4,No,
12498,r142,Department of Agriculture -> Animal and Plant Health Inspection Service,Department of Agriculture,Animal and Plant Health Inspection Service,,,,2,No,
12498,r143,Department of Agriculture -> Animal and Plant Health Inspection Service -> Science and Technology,Department of Agriculture,Animal and Plant Health Inspection Service,Science and Technology,,,3,No,
12498,r144,Department of Agriculture -> Animal and Plant Health Inspection Service -> Science and Technology -> Center for Veterinary Biologics<sup>a</sup>,Department of Agriculture,Animal and Plant Health Inspection Service,Science and Technology,Center for Veterinary Biologics<sup>a</sup>,,4,Yes,Yes
12498,r145,Department of Agriculture -> Animal and Plant Health Inspection Service -> Science and Technology -> Forest Pest Methods Laboratory,Department of Agriculture,Animal and Plant Health Inspection Service,Science and Technology,Forest Pest Methods Laboratory,,4,Yes,Yes
12498,r146,Department of Agriculture -> Animal and Plant Health Inspection Service -> Science and Technology -> Insect Management and Molecular Diagnostics Laboratory,Department of Agriculture,Animal and Plant Health Inspection Service,Science and Technology,Insect Management and Molecular Diagnostics Laboratory,,4,Yes,Yes
12498,r147,Department of Agriculture -> Animal and Plant Health Inspection Service -> Science and Technology -> National Veterinary Services Laboratories<sup>a</sup>,Department of Agriculture,Animal and Plant Health Inspection Service,Science and Technology,National Veterinary Services Laboratories<sup>a</sup>,,4,Yes,Yes
12498,r148,Department of Agriculture -> Animal and Plant Health Inspection Service -> Science and Technology -> National Wildlife Research Center,Department of Agriculture,Animal and Plant Health Inspection Service,Science and Technology,National Wildlife Research Center,,4,Yes,Yes
12498,r149,Department of Agriculture -> Animal and Plant Health Inspection Service -> Science and Technology -> Plant Pathogen Confirmatory Diagnostics Laboratory,Department of Agriculture,Animal and Plant Health Inspection Service,Science and Technology,Plant Pathogen Confirmatory Diagnostics Laboratory,,4,Yes,Yes
12498,r150,Department of Agriculture -> Animal and Plant Health Inspection Service -> Science and Technology -> Treatment and Inspection Methods Laboratory,Department of Agriculture,Animal and Plant Health Inspection Service,Science and Technology,Treatment and Inspection Methods Laboratory,,4,Yes,Yes
12498,r151,Department of Agriculture -> Economic Research Service,Department of Agriculture,Economic Research Service,,,,2,Yes,Yes
12498,r152,Department of Agriculture -> Forest Service,Department of Agriculture,Forest Service,,,,2,No,
12498,r153,Department of Agriculture -> Forest Service -> Forest Products Laboratory,Department of Agriculture,Forest Service,Forest Products Laboratory,,,3,Yes,Yes
12498,r154,Department of Agriculture -> Forest Service -> International Institute of Tropical Forestry,Department of Agriculture,Forest Service,International Institute of Tropical Forestry,,,3,Yes,Yes
12498,r155,Department of Agriculture -> Forest Service -> Northern Research Station,Department of Agriculture,Forest Service,Northern Research Station,,,3,Yes,Yes
12498,r156,Department of Agriculture -> Forest Service -> Pacific Northwest Research Station,Department of Agriculture,Forest Service,Pacific Northwest Research Station,,,3,Yes,Yes
12498,r157,Department of Agriculture -> Forest Service -> Pacific Southwest Research Station,Department of Agriculture,Forest Service,Pacific Southwest Research Station,,,3,Yes,Yes
12498,r158,Department of Agriculture -> Forest Service -> Rocky Mountain Research Station,Department of Agriculture,Forest Service,Rocky Mountain Research Station,,,3,Yes,Yes
12498,r159,Department of Agriculture -> Forest Service -> Southern Research Station,Department of Agriculture,Forest Service,Southern Research Station,,,3,Yes,Yes
12498,r160,Department of Agriculture -> Forest Service -> Washington Office Research and Development,Department of Agriculture,Forest Service,Washington Office Research and Development,,,3,Yes,Yes
12498,r161,Department of Agriculture -> National Agricultural Statistics Service,Department of Agriculture,National Agricultural Statistics Service,,,,2,Yes,Yes
12498,r162,Department of Agriculture -> Natural Resources Conservation Service,Department of Agriculture,Natural Resources Conservation Service,,,,2,No,
12498,r163,Department of Agriculture -> Natural Resources Conservation Service -> Plant Materials Center,Department of Agriculture,Natural Resources Conservation Service,Plant Materials Center,,,3,Yes,Yes
12498,r164,Department of Agriculture -> Natural Resources Conservation Service -> Soil Science Research Branch,Department of Agriculture,Natural Resources Conservation Service,Soil Science Research Branch,,,3,Yes,Yes
12498,r165,Department of Commerce,Department of Commerce,,,,,1,No,
12498,r166,Department of Commerce -> Census Bureau,Department of Commerce,Census Bureau,,,,2,Yes,Yes
12498,r167,Department of Commerce -> Census Bureau -> Center for Behavioral Science Methods,Department of Commerce,Census Bureau,Center for Behavioral Science Methods,,,3,No,
12498,r168,Department of Commerce -> Census Bureau -> Center for Statistical Research and Methodology,Department of Commerce,Census Bureau,Center for Statistical Research and Methodology,,,3,No,
12498,r169,Department of Commerce -> National Institute of Standards and Technology,Department of Commerce,National Institute of Standards and Technology,,,,2,Yes,Yes
12498,r170,Department of Commerce -> National Institute of Standards and Technology -> Center for Neutron Research,Department of Commerce,National Institute of Standards and Technology,Center for Neutron Research,,,3,No,
12498,r171,Department of Commerce -> National Institute of Standards and Technology -> Communications Technology Laboratory,Department of Commerce,National Institute of Standards and Technology,Communications Technology Laboratory,,,3,No,
12498,r172,Department of Commerce -> National Institute of Standards and Technology -> Engineering Laboratory,Department of Commerce,National Institute of Standards and Technology,Engineering Laboratory,,,3,No,
12498,r173,Department of Commerce -> National Institute of Standards and Technology -> Information Technology Laboratory,Department of Commerce,National Institute of Standards and Technology,Information Technology Laboratory,,,3,No,
12498,r174,Department of Commerce -> National Institute of Standards and Technology -> Material Measurement Laboratory,Department of Commerce,National Institute of Standards and Technology,Material Measurement Laboratory,,,3,No,
12498,r175,Department of Commerce -> National Institute of Standards and Technology -> Physical Measurement Laboratory,Department of Commerce,National Institute of Standards and Technology,Physical Measurement Laboratory,,,3,No,
12498,r176,Department of Commerce -> National Oceanic and Atmospheric Administration,Department of Commerce,National Oceanic and Atmospheric Administration,,,,2,No,
12498,r177,Department of Commerce -> National Oceanic and Atmospheric Administration -> Mission Support,Department of Commerce,National Oceanic and Atmospheric Administration,Mission Support,,,3,No,
12498,r178,Department of Commerce -> National Oceanic and Atmospheric Administration -> Mission Support -> Office of the Chief Administrative Officer,Department of Commerce,National Oceanic and Atmospheric Administration,Mission Support,Office of the Chief Administrative Officer,,4,Yes,Yes
12498,r179,Department of Commerce -> National Oceanic and Atmospheric Administration -> Mission Support -> Office of the Chief Information Officer,Department of Commerce,National Oceanic and Atmospheric Administration,Mission Support,Office of the Chief Information Officer,,4,Yes,Yes
12498,r180,"Department of Commerce -> National Oceanic and Atmospheric Administration -> National Environmental Satellite, Data, and Information Service",Department of Commerce,National Oceanic and Atmospheric Administration,"National Environmental Satellite, Data, and Information Service",,,3,No,
12498,r181,"Department of Commerce -> National Oceanic and Atmospheric Administration -> National Environmental Satellite, Data, and Information Service -> Center for Satellite Applications and Research",Department of Commerce,National Oceanic and Atmospheric Administration,"National Environmental Satellite, Data, and Information Service",Center for Satellite Applications and Research,,4,Yes,Yes
12498,r182,"Department of Commerce -> National Oceanic and Atmospheric Administration -> National Environmental Satellite, Data, and Information Service -> National Centers for Environmental Information",Department of Commerce,National Oceanic and Atmospheric Administration,"National Environmental Satellite, Data, and Information Service",National Centers for Environmental Information,,4,Yes,Yes
12498,r183,Department of Commerce -> National Oceanic and Atmospheric Administration -> National Marine Fisheries Service,Department of Commerce,National Oceanic and Atmospheric Administration,National Marine Fisheries Service,,,3,No,
12498,r184,Department of Commerce -> National Oceanic and Atmospheric Administration -> National Marine Fisheries Service -> Alaska Fisheries Science Center,Department of Commerce,National Oceanic and Atmospheric Administration,National Marine Fisheries Service,Alaska Fisheries Science Center,,4,Yes,Yes
12498,r185,Department of Commerce -> National Oceanic and Atmospheric Administration -> National Marine Fisheries Service -> Alaska Regional Office,Department of Commerce,National Oceanic and Atmospheric Administration,National Marine Fisheries Service,Alaska Regional Office,,4,Yes,Yes
12498,r186,Department of Commerce -> National Oceanic and Atmospheric Administration -> National Marine Fisheries Service -> Greater Atlantic Region Fisheries Office,Department of Commerce,National Oceanic and Atmospheric Administration,National Marine Fisheries Service,Greater Atlantic Region Fisheries Office,,4,Yes,Yes
12498,r187,Department of Commerce -> National Oceanic and Atmospheric Administration -> National Marine Fisheries Service -> Northeast Fisheries Science Center,Department of Commerce,National Oceanic and Atmospheric Administration,National Marine Fisheries Service,Northeast Fisheries Science Center,,4,Yes,Yes
12498,r188,Department of Commerce -> National Oceanic and Atmospheric Administration -> National Marine Fisheries Service -> Northwest Fisheries Science Center,Department of Commerce,National Oceanic and Atmospheric Administration,National Marine Fisheries Service,Northwest Fisheries Science Center,,4,Yes,Yes
12498,r189,Department of Commerce -> National Oceanic and Atmospheric Administration -> National Marine Fisheries Service -> Office of Habitat Conservation,Department of Commerce,National Oceanic and Atmospheric Administration,National Marine Fisheries Service,Office of Habitat Conservation,,4,Yes,Yes
12498,r190,Department of Commerce -> National Oceanic and Atmospheric Administration -> National Marine Fisheries Service -> Office of Protected Resources,Department of Commerce,National Oceanic and Atmospheric Administration,National Marine Fisheries Service,Office of Protected Resources,,4,Yes,Yes
12498,r191,Department of Commerce -> National Oceanic and Atmospheric Administration -> National Marine Fisheries Service -> Office of Science and Technology,Department of Commerce,National Oceanic and Atmospheric Administration,National Marine Fisheries Service,Office of Science and Technology,,4,Yes,Yes
12498,r192,Department of Commerce -> National Oceanic and Atmospheric Administration -> National Marine Fisheries Service -> Office of Sustainable Fisheries,Department of Commerce,National Oceanic and Atmospheric Administration,National Marine Fisheries Service,Office of Sustainable Fisheries,,4,Yes,Yes
12498,r193,Department of Commerce -> National Oceanic and Atmospheric Administration -> National Marine Fisheries Service -> Pacific Island Fisheries Science Center,Department of Commerce,National Oceanic and Atmospheric Administration,National Marine Fisheries Service,Pacific Island Fisheries Science Center,,4,Yes,Yes
12498,r194,Department of Commerce -> National Oceanic and Atmospheric Administration -> National Marine Fisheries Service -> Pacific Islands Regional Office,Department of Commerce,National Oceanic and Atmospheric Administration,National Marine Fisheries Service,Pacific Islands Regional Office,,4,Yes,Yes
12498,r195,Department of Commerce -> National Oceanic and Atmospheric Administration -> National Marine Fisheries Service -> Southeast Fisheries Science Center,Department of Commerce,National Oceanic and Atmospheric Administration,National Marine Fisheries Service,Southeast Fisheries Science Center,,4,Yes,Yes
12498,r196,Department of Commerce -> National Oceanic and Atmospheric Administration -> National Marine Fisheries Service -> Southeast Regional Office,Department of Commerce,National Oceanic and Atmospheric Administration,National Marine Fisheries Service,Southeast Regional Office,,4,Yes,Yes
12498,r197,Department of Commerce -> National Oceanic and Atmospheric Administration -> National Marine Fisheries Service -> Southwest Fisheries Science Center,Department of Commerce,National Oceanic and Atmospheric Administration,National Marine Fisheries Service,Southwest Fisheries Science Center,,4,Yes,Yes
12498,r198,Department of Commerce -> National Oceanic and Atmospheric Administration -> National Marine Fisheries Service -> West Coast Region,Department of Commerce,National Oceanic and Atmospheric Administration,National Marine Fisheries Service,West Coast Region,,4,Yes,Yes
12498,r199,Department of Commerce -> National Oceanic and Atmospheric Administration -> National Ocean Service,Department of Commerce,National Oceanic and Atmospheric Administration,National Ocean Service,,,3,No,
12498,r200,Department of Commerce -> National Oceanic and Atmospheric Administration -> National Ocean Service -> Center for Operational Oceanographic Products and Services,Department of Commerce,National Oceanic and Atmospheric Administration,National Ocean Service,Center for Operational Oceanographic Products and Services,,4,Yes,Yes
12498,r201,Department of Commerce -> National Oceanic and Atmospheric Administration -> National Ocean Service -> Integrated Ocean Observing System,Department of Commerce,National Oceanic and Atmospheric Administration,National Ocean Service,Integrated Ocean Observing System,,4,Yes,Yes
12498,r202,Department of Commerce -> National Oceanic and Atmospheric Administration -> National Ocean Service -> National Centers for Coastal Ocean Science,Department of Commerce,National Oceanic and Atmospheric Administration,National Ocean Service,National Centers for Coastal Ocean Science,,4,Yes,Yes
12498,r203,Department of Commerce -> National Oceanic and Atmospheric Administration -> National Ocean Service -> National Geodetic Survey,Department of Commerce,National Oceanic and Atmospheric Administration,National Ocean Service,National Geodetic Survey,,4,Yes,Yes
12498,r204,Department of Commerce -> National Oceanic and Atmospheric Administration -> National Ocean Service -> Office for Coastal Management,Department of Commerce,National Oceanic and Atmospheric Administration,National Ocean Service,Office for Coastal Management,,4,Yes,Yes
12498,r205,Department of Commerce -> National Oceanic and Atmospheric Administration -> National Ocean Service -> Office of Response and Restoration,Department of Commerce,National Oceanic and Atmospheric Administration,National Ocean Service,Office of Response and Restoration,,4,Yes,Yes
12498,r206,Department of Commerce -> National Oceanic and Atmospheric Administration -> National Ocean Service -> Office of the Coast Survey,Department of Commerce,National Oceanic and Atmospheric Administration,National Ocean Service,Office of the Coast Survey,,4,Yes,Yes
12498,r207,Department of Commerce -> National Oceanic and Atmospheric Administration -> National Weather Service,Department of Commerce,National Oceanic and Atmospheric Administration,National Weather Service,,,3,No,
